{
  "version": 1,
  "root": "../../..",
  "deadline_seconds": 600,
  "probes": [
    {
      "name": "killed-count",
      "scenario_id": "ID-MUT-156",
      "source_path": "../../../features/mutate_strict.go",
      "original": "if f[\"killed\"] != float64(1) || f[\"survived\"] != float64(0) || f[\"uncovered\"] != float64(0) {",
      "replacement": "if f[\"killed\"] != float64(2) || f[\"survived\"] != float64(0) || f[\"uncovered\"] != float64(0) {",
      "assertion": {
        "uri": "mutate.feature",
        "line": 2494,
        "name": "the function's mutant counts remain killed mutants only, with zero uncovered mutants",
        "error_token": "strict counts"
      }
    }
  ]
}
